{"action_digest":"sha256:b54967fc908149766c71e5281482981b803069284a104b6458d6efd5dd3bedbb","authorization_id":"auth-1","evidence_digest":"sha256:9f2d76050755f66315c7b0900d9fcd5c395385b97c7b793c592881c431c6b26a","expires_at":"2026-08-05T00:05:00Z","issued_at":"2026-08-05T00:00:00Z","nonce":"nnnnnnnnnnnnnnnn","rulebook_digest":"sha256:eb851f1c213105876977484d3f41cd724811819fc65044a0c87cd29c829570ee","runtime_id":"runtime-1","signature":{"alg":"ed25519","key_id":"auth-key","key_version":1,"value":"vmF0jQsFS5HYRVMayR8aaaW7AHFrMzB3D7nXB8AvR35QFdfpg46Gfkj6/U8VRITbqXD5LN+UrdufMDLSKAL5Cg=="}}